{
  "id": "run-orbit-rerun-startup",
  "version": "1.0",
  "title": "Run Orbit rerun startup",
  "goal": "Let Samwise stage a fresh main-based Orbit build attempt, freeze the execution contract, and hand the live lane to the dedicated Orbit rerun execution session.",
  "steps": [
    {
      "text": "Load the active Orbit execution artifacts plus the explicit handoff artifacts named by the intent parameters, beginning with `Docs/Orbit/Execution/Orbit-Build-Rerun-Checklist.md`, `Docs/Orbit/Execution/Orbit-Product-Acceptance-Checklist.md`, the explicit `rerunPrepPath`, and the explicit `retrospectivePath`."
    },
    {
      "text": "Summarize the current attempt contract: first-slice scope, required participants, required evidence, required product gates, and the hybrid retrospective closeout rule."
    },
    {
      "text": "Confirm the approved lane is bootstrapped, run baseline validation, and stop if the rerun prerequisites are not green."
    },
    {
      "text": "Record the active participants for this attempt and the concrete evidence expected from each role before implementation begins."
    },
    {
      "text": "Hand the active lane to `samwise-orbit-rerun-execution` once startup prerequisites are green, and do not let this startup session stand in for the required multiagent execution loop."
    },
    {
      "text": "Record the exact attempt-specific product, interaction, validation, participant-evidence, red-pen, evidence-packet, and retrospective artifact paths plus the review gates that the execution session must satisfy before any `review-ready` or `MVP candidate` language is allowed."
    },
    {
      "text": "Update the rerun-prep artifact with startup state, worktree identity, required session map, the exact attempt-specific artifact paths, and the execution-handoff note."
    },
    {
      "text": "Pause for AJ review if startup prerequisites are not green, the required session routing is missing, or a structural workflow gap is discovered before the live execution handoff.",
      "requiresReview": true
    }
  ],
  "acceptanceCriteria": [
    "The rerun starts from the active Orbit checklist and acceptance docs instead of thread memory alone",
    "Required participants and evidence are explicit before implementation begins",
    "The startup pass hands the active lane to `samwise-orbit-rerun-execution` instead of letting Samwise implement solo inside the staging session",
    "The execution session inherits explicit artifact paths, review gates, and participant expectations",
    "The rerun-prep artifact records startup state and handoff conditions for the live lane"
  ],
  "verification": [
    {
      "kind": "manual",
      "text": "Confirm the current attempt contract names the first slice, active participants, evidence expectations, and required review gates"
    },
    {
      "kind": "manual",
      "text": "Confirm the startup pass names `samwise-orbit-rerun-execution` as the live execution surface instead of using the staging session for substantive implementation"
    },
    {
      "kind": "manual",
      "text": "Confirm attempt-specific artifact paths and expected session routing are explicit before the first code slice"
    },
    {
      "kind": "manual",
      "text": "Confirm the rerun-prep artifact was updated with startup state, worktree identity, and handoff conditions"
    },
    {
      "kind": "manual",
      "text": "Confirm retrospective closeout remains owned by `samwise-orbit-rerun-execution` instead of being treated as part of the startup session itself"
    },
    {
      "kind": "command",
      "text": "swift run personakit validate --root .personakit"
    },
    {
      "kind": "command",
      "text": "Scripts/check-worktree-squad-logs.sh"
    }
  ],
  "requiresIntentTemplateIds": [
    "orbit-rerun-startup-contract"
  ],
  "requiresSkillIds": [
    "codex-cli"
  ]
}
