{
  "id": "run-venture-product-discovery",
  "version": "1.0",
  "title": "Run venture product discovery",
  "goal": "Convert a product idea into a bounded feature brief with explicit decision gate and quality check.",
  "steps": [
    {
      "text": "Define problem statement, target user, and desired outcome."
    },
    {
      "text": "Draft feature brief using template sections and explicit in/out scope."
    },
    {
      "text": "Capture risks, unknowns, dependencies, and proposed decision gate."
    },
    {
      "text": "Apply venture product quality gate and record result (`pass`, `pass-with-notes`, `fail`)."
    },
    {
      "text": "Pause for AJ review before promoting brief to delivery planning.",
      "requiresReview": true
    }
  ],
  "acceptanceCriteria": [
    "Feature brief includes all required template sections",
    "Quality gate result is recorded",
    "Unknowns and risks are explicit",
    "No implementation work is proposed without review"
  ],
  "verification": [
    {
      "kind": "manual",
      "text": "Confirm brief includes problem statement, scope boundaries, acceptance criteria, and decision gate"
    },
    {
      "kind": "manual",
      "text": "Confirm quality gate classification is present and justified"
    }
  ],
  "requiresIntentTemplateIds": [
    "shape-macos-feature-opportunity"
  ],
  "requiresSkillIds": [
    "codex-cli"
  ]
}
