{
  "id": "close-squad-role-coverage-gap-loop",
  "version": "1.0",
  "title": "Close approved squad role-coverage gaps",
  "goal": "Remediate approved missing-role or covered-with-gaps findings from a squad-planning pass and return a cleaner handoff for execution or further planning.",
  "steps": [
    {
      "text": "Load the target planning report and machine-readable planning log entry."
    },
    {
      "text": "Select only AJ-approved role gaps for remediation and map each gap to the smallest sufficient follow-up path: reverse-interview, hiring-gap remediation, bounded pack updates, or explicit defer."
    },
    {
      "text": "When a role depends on a new or uncertain persona, route through `samwise-persona-hiring` first and use `samwise-persona-hiring-calibration` if approved gap closure requires structural artifact updates."
    },
    {
      "text": "Draft bounded remediation changes with explicit role owners, updated definition of done, and validation checks for the first blocked checkpoint."
    },
    {
      "text": "Pause for AJ review before applying structural pack, persona, or session updates.",
      "requiresReview": true
    },
    {
      "text": "Apply only approved updates and run PersonaKit validation plus squad-planning-log checks, and run hiring-log checks only when the remediation path updated hiring artifacts."
    },
    {
      "text": "Write remediation status back into the planning report and planning JSONL stream, including updated role coverage, any related hiring review IDs, and the recommended next session."
    },
    {
      "text": "If execution-critical role coverage remains missing or low-confidence, stop and route back to planning or hiring rather than handing off to execution."
    }
  ],
  "acceptanceCriteria": [
    "Only AJ-approved role gaps were remediated",
    "Each remediated role gap maps to a concrete hiring or artifact update path",
    "New or uncertain persona work produced reverse-interview evidence before execution handoff",
    "Planning report and JSONL entry reflect updated role coverage and next session",
    "Validation and squad-planning-log checks pass after approved updates",
    "Hiring-log checks pass when the remediation path updated hiring artifacts",
    "Execution handoff does not occur while execution-critical role coverage remains missing or low-confidence"
  ],
  "verification": [
    {
      "kind": "command",
      "text": "swift run personakit validate --root .personakit"
    },
    {
      "kind": "command",
      "text": "If the remediation path updated hiring artifacts, run `Scripts/check-persona-hiring-logs.sh` and confirm `PERSONA_HIRING_LOGS_CHECK:PASS`."
    },
    {
      "kind": "command",
      "text": "Scripts/check-squad-planning-logs.sh"
    },
    {
      "kind": "manual",
      "text": "Confirm planning report and JSONL entry identify the same updated next session and role-coverage status"
    }
  ],
  "requiresIntentTemplateIds": [
    "remediate-squad-role-coverage-gaps",
    "reverse-interview-persona-fit",
    "remediate-persona-hiring-gaps"
  ],
  "requiresSkillIds": [
    "codex-cli"
  ]
}
