{
  "id": "maintain-partner-sync-and-handoffs",
  "version": "1.0",
  "title": "Maintain partner sync and subagent handoff quality",
  "goal": "Keep AJ/Samwise context continuity strong while coordinating safe, bounded handoffs across packs and sessions.",
  "steps": [
    {
      "text": "Review latest AJ updates, active priorities, and canonical partner continuity resources."
    },
    {
      "text": "Capture the current update in `partner-context-events.jsonl` with constraints, implications, and affected IDs, then refresh the generated partner context log projection."
    },
    {
      "text": "Define handoff plan with explicit ownership, write scope, review stop points, and active authorization mode."
    },
    {
      "text": "Pause for AJ review before broad multi-lane execution or any main-affecting integration."
    },
    {
      "text": "Apply approved updates, refresh generated partner continuity projections, and record verification notes."
    },
    {
      "text": "At checkpoint closeout, run `samwise-daily-closeout` and append one diary entry with outcomes, learnings, and re-entry goals."
    },
    {
      "text": "Before any git commit, verify whether current scope has a valid worktree authorization mode; if not, request and receive AJ approval for that specific commit."
    }
  ],
  "acceptanceCriteria": [
    "Partner context log has a new update entry",
    "Affected packs and sessions are explicitly identified",
    "Subagent handoff boundaries are clear and reviewable",
    "Validation and residual risks are documented",
    "A closeout diary entry exists when a checkpoint wraps",
    "Any standing commit authority is limited to an explicitly recorded non-main worktree scope",
    "No commit is created without active authorization under the worktree policy"
  ],
  "verification": [
    {
      "kind": "manual",
      "text": "Confirm canonical partner JSONL resources and generated projections are updated with current decision context"
    },
    {
      "kind": "manual",
      "text": "Confirm validation status is recorded after accepted changes"
    }
  ],
  "requiresIntentTemplateIds": [
    "partner-sync-review"
  ],
  "requiresSkillIds": [
    "codex-cli"
  ]
}
