{
  "id": "maintain-rosie-worktree-upkeep-loop",
  "version": "1.0",
  "title": "Maintain Rosie dedicated worktree upkeep loop",
  "goal": "Run repeatable Rosie gardening cycles with explicit lane scope, mainline integration gates, and deterministic logs.",
  "steps": [
    {
      "text": "Review AJ priorities, active lane status, and latest partner/gardening logs."
    },
    {
      "text": "Confirm active scope is the AJ-approved dedicated non-main Rosie lane (`rosies-garden`) and record scope verification."
    },
    {
      "text": "Identify bounded gardening updates for this pass and record affected IDs."
    },
    {
      "text": "Run `gardening-v2-checklist` and capture pass status before recommendations are finalized."
    },
    {
      "text": "Pause for AJ review before applying non-trivial updates or performing lane-to-main integration.",
      "requiresReview": true
    },
    {
      "text": "Apply approved lane updates, commit within lane scope, and refresh partner/handoff/gardening logs."
    },
    {
      "text": "Execute approved lane-to-main integration and back-sync, then run validation and record residual risks."
    }
  ],
  "acceptanceCriteria": [
    "Scope verification is recorded for the active upkeep pass",
    "Partner and gardening logs capture affected IDs and decisions",
    "Gardening v2 checklist status is recorded before execution",
    "No history-altering lane-to-main integration occurs without AJ review",
    "Validation status is recorded after approved updates and sync",
    "Rosie lane is synchronized with latest main baseline for the next pass"
  ],
  "verification": [
    {
      "kind": "manual",
      "text": "Confirm partner context and handoff logs record lane scope, decisions, and approval mode"
    },
    {
      "kind": "manual",
      "text": "Confirm pack gardener log and gardening-events JSONL include phase label, affected IDs, and verification status"
    },
    {
      "kind": "manual",
      "text": "Run Scripts/check-gardening-logs.sh and confirm GARDENING_LOGS_CHECK:PASS"
    },
    {
      "kind": "manual",
      "text": "Confirm repository validation status and unresolved sync risks are recorded"
    }
  ],
  "requiresIntentTemplateIds": [
    "rosie-worktree-upkeep-review"
  ],
  "requiresSkillIds": [
    "codex-cli"
  ]
}
