{
  "id": "garden-git-history-and-context",
  "version": "1.0",
  "title": "Garden git history and context quality",
  "goal": "Continuously improve commit history quality while preserving deterministic decision traceability and explicit human control.",
  "steps": [
    {
      "text": "Review target commit range and identify quality candidates (keep, squash, fixup follow-up, or drop proposal)."
    },
    {
      "text": "Classify each candidate with rationale, risk, and non-destructive alternatives."
    },
    {
      "text": "Produce a proposal report with candidate commits, rationale, risk, and exact command plan marked pending approval."
    },
    {
      "text": "Record each decision and proposed action in markdown, session-specific JSONL, and shared gardening JSONL logs using required fields."
    },
    {
      "text": "Pause for review and approval before any history-altering action.",
      "requiresReview": true
    },
    {
      "text": "Apply only approved actions and re-run validation/status checks."
    }
  ],
  "acceptanceCriteria": [
    "Candidate commits and decisions are captured with stable IDs",
    "Proposal report is generated before any history-altering action is attempted",
    "Session-specific and shared gardening JSONL entries satisfy required field contracts",
    "No history-altering action occurs without explicit approval",
    "Post-action verification status is recorded"
  ],
  "verification": [
    {
      "kind": "manual",
      "text": "Confirm Docs/PersonaKit/Development/git-history-gardener-proposals.md exists and proposal statuses are explicit"
    },
    {
      "kind": "manual",
      "text": "Confirm Docs/PersonaKit/Development/git-history-gardener-log.md captures range, decisions, and review outcomes"
    },
    {
      "kind": "manual",
      "text": "Confirm Docs/PersonaKit/Development/logs/git-history-gardener.jsonl entries parse and include all required fields"
    },
    {
      "kind": "manual",
      "text": "Confirm Docs/PersonaKit/Development/logs/gardening-events.jsonl mirrors accepted decisions with shared base fields"
    },
    {
      "kind": "manual",
      "text": "Run Scripts/check-gardening-logs.sh and confirm GARDENING_LOGS_CHECK:PASS"
    },
    {
      "kind": "manual",
      "text": "Confirm git status and relevant validation checks are recorded after approved actions"
    }
  ],
  "requiresIntentTemplateIds": [
    "git-history-garden-review"
  ],
  "requiresSkillIds": [
    "codex-cli"
  ]
}
