{
  "id": "run-venture-product-planning",
  "version": "1.0",
  "title": "Run venture product planning",
  "goal": "Translate approved feature brief into milestone plan with status model, dependencies, and risk controls.",
  "steps": [
    {
      "text": "Load approved feature brief and extract delivery-relevant scope."
    },
    {
      "text": "Define milestone sequence with owners, dependencies, and exit criteria."
    },
    {
      "text": "Identify top risks, blocker conditions, and required decisions."
    },
    {
      "text": "Apply venture product quality gate to planning artifact and record result."
    },
    {
      "text": "Pause for AJ review before execution handoff.",
      "requiresReview": true
    }
  ],
  "acceptanceCriteria": [
    "Milestones use standard fields and explicit status model",
    "Dependencies and blockers are explicit",
    "Quality gate result is recorded",
    "Plan remains bounded to approved feature scope"
  ],
  "verification": [
    {
      "kind": "manual",
      "text": "Confirm plan includes milestone ID, owner, status, risks, dependencies, and exit criteria"
    },
    {
      "kind": "manual",
      "text": "Confirm quality gate classification is present and justified"
    }
  ],
  "requiresIntentTemplateIds": [
    "plan-macos-feature-delivery"
  ],
  "requiresSkillIds": [
    "codex-cli"
  ]
}
